{"$schema":"https://json-schema.org/draft/2020-12/schema","$id":"atlas.asset/1","title":"One baked graphic of the web (waves, palette, procedural texture, sonification), with its text frame","type":"object","additionalProperties":false,"required":["v","id","kind","frame","data"],
"properties":{"v":{"const":"atlas.asset/1"},"id":{"type":"string","pattern":"^[a-z0-9-]+$"},"kind":{"enum":["wave","palette","texture","sound"]},"frame":{"type":"object","additionalProperties":false,"required":["t","d"],"properties":{"t":{"type":"string","minLength":1,"maxLength":80},"d":{"type":"string","minLength":1,"maxLength":600},"role":{"type":"string","minLength":1,"maxLength":40}}},"data":{"type":"object"}}}
