{"v":"atlas.asset/1","id":"sea-palette","kind":"palette","frame":{"t":"Sea palette","d":"Four bands of the sunken forest: deep water, shallow water, sand and moss. Each band also has a pattern, so colour is never the only cue.","role":"floor"},"data":{"bands":[{"kind":"water","h":0,"var":"--sea-deep","pattern":"waves"},{"kind":"floor","h":1,"var":"--sea-sand","pattern":"dots"},{"kind":"floor","h":2,"var":"--sea-moss","pattern":"hatch"},{"kind":"floor","h":3,"var":"--sea-rock","pattern":"cross"}]}}
